"relationship","expected_cardinality","tested","status","independent_row_guard","support_label"
"SED source row to analysis checklist","many-to-one",TRUE,"PASS",TRUE,"SUPPORT_ONLY_NOT_AN_EFFECT_ESTIMATE"
"EBD focal row to SED source key","many-to-one",TRUE,"PASS",TRUE,"SUPPORT_ONLY_NOT_AN_EFFECT_ESTIMATE"
"collapsed checklist-taxon outcome","unique composite key",TRUE,"PASS",TRUE,"SUPPORT_ONLY_NOT_AN_EFFECT_ESTIMATE"
"checklist to concurrent herring event","many-to-many exposure crosswalk; checklist remains analysis unit",TRUE,"PASS",TRUE,"SUPPORT_ONLY_NOT_AN_EFFECT_ESTIMATE"
"species to primary guild","many-to-one",TRUE,"PASS",TRUE,"SUPPORT_ONLY_NOT_AN_EFFECT_ESTIMATE"
